Source url,Source title,Response code,Backlinks,Domains,External links,Internal links,Last seen
http://freshdesk.com.br/,Freshdesk - Software de suporte ao cliente online e solução de helpdesk,200,548,31,14,31,2017-06-26
http://blog.freshdesk.com.br/,Freshdesk | Portuguese - Just another Freshdesk Blogs Sites site,200,59,1,14,34,2017-12-04
http://freshdesk.com.br/precos,Planos e preços do Freshdesk | Avaliação do software de helpdesk Freshdesk,200,3,2,14,34,2017-11-16
https://freshdesk.com.br/,Freshdesk - Software de suporte ao cliente online e solução de helpdesk,200,1,1,14,31,2017-11-16
http://freshdesk.com.br/envolvimento-do-cliente/atendimento-redes-sociais/,Converter os comentários do Facebook e citações no Twitter em tickets para o helpdesk | Software social de serviço de atendimento ao cliente – Freshdesk,200,0,0,14,34,2017-06-26
http://freshdesk.com.br/integracoes/social-help-desk-facebook/,Facebook – Integração do Freshdesk | Converter comentários do FB e postagens no mural em tickets do helpdesk,200,0,0,15,29,2017-02-26
http://freshdesk.com.br/servco-de-autoatendimento,Crie uma experiência de autoatendimento que ofereça suporte à sua marca,200,0,0,14,64,2017-06-16
http://freshdesk.com.br/envolvimento-do-cliente/inquerito-de-satisfacao-do-cliente/,Inquérito de satisfação dos clientes de helpdesk | Avalie seus serviços de helpdesk com inquéritos e relatórios de satisfação dos clientes do Freshdesk,200,0,0,16,32,2017-02-10
http://freshdesk.com.br/inscreve-sa,,404,0,0,1,4,2017-11-15
http://freshdesk.com.br/envolvimento-do-cliente/widget-feedback/,Widget de feedback do Freshdesk | Formulário de tickets onde você quiser,200,0,0,17,32,2017-02-26
http://freshdesk.com.br/automatizacao-do-helpdesk/,Automatização do helpdesk para facilitar o suporte ao cliente,200,0,0,18,35,2017-03-16
http://freshdesk.com.br/automatizacao-do-helpdesk/supervisionar-processos-suporte/,"Supervisor – Automação do Helpdesk | Fechar, escalar tickets e gerenciar a insatisfação do cliente",200,0,0,17,31,2017-04-24
http://freshdesk.com.br/inscreva-se/?plan=estate,Suporte ao cliente Freshdesk e software de helpdesk | Obtenha GRÁTIS,200,0,0,4,3,2017-12-08
http://freshdesk.com.br/helpdesk-funcionalidades/,Comparação dos recursos do Freshdesk | Itens essenciais para uma solução de helpdesk líder do mercado | Veja qual dos planos do Freshdesk é o mais adequado para você!,200,0,0,17,52,2017-11-16
http://freshdesk.com.br/base-de-conhecimento/,,404,0,0,1,4,2017-11-15
http://freshdesk.com.br/escalar-o-suporte/gamification-suporte-help-desk,Gamificação do helpdesk | Gamifique seu suporte ao cliente com o Freshdesk,200,0,0,15,32,2017-11-16
http://freshdesk.com.br/relatorios/#demo-form,Calcule e controle o desempenho usando os relatórios helpdesk,200,0,0,14,65,2017-12-02
http://freshdesk.com.br/helpdesk-seguro/,Ofereça um suporte fantástico sem se preocupar sobre a segurança de dados,200,0,0,14,62,2017-06-26
http://freshdesk.com.br/gerenciamento-do-helpdesk/emissao-de-tickets-de-helpdesk-por-email,Responda aos seus tickets de suporte através do email sem fazer logon no seu Suporte | Software de Suporte ao Cliente Freshdesk,200,0,0,14,36,2017-06-25
http://freshdesk.com.br/envolvimento-do-cliente/atendimento-redes-sociais,Converter os comentários do Facebook e citações no Twitter em tickets para o helpdesk | Software social de serviço de atendimento ao cliente – Freshdesk,200,0,0,14,34,2017-06-25
http://freshdesk.com.br/automatizacao-do-helpdesk/distribuidor-automatico-tickets/,Distribuidor – Automação interna no software de suporte ao cliente.,200,0,0,14,36,2017-06-26
http://freshdesk.com.br/escalar-o-suporte/gamification-suporte-help-desk/,Gamificação do helpdesk | Gamifique seu suporte ao cliente com o Freshdesk,200,0,0,18,29,2017-12-08
http://freshdesk.com.br/integracoes,"Integrações Freshdesk | Software de helpdesk que integra com Capsule CRM, Freshbooks, Harvest, JIRA, para um suporte All-In-One",200,0,0,14,26,2017-05-02
http://freshdesk.com.br/customer-care-tools,Freshdesk | Ferramenta de atendimento ao cliente online e aplicativo de central de suporte,200,0,0,7,3,2017-11-28
http://freshdesk.com.br/contato/,Fale com a Freshdesk,200,0,0,14,26,2017-06-26
http://freshdesk.com.br/produtividade/,Aumente a produtividade e o envolvimento dos operadores com o Freshdesk,200,0,0,14,66,2017-06-26
http://freshdesk.com.br/inscreva-se/,Suporte ao cliente Freshdesk e software de helpdesk | Obtenha GRÁTIS,200,0,0,4,3,2017-06-25
http://freshdesk.com.br/envolvimento-do-cliente/forum-da-comunidade/,Conquiste seus clientes online com o Fórum da Comunidade do Freshdesk. Capte ideias para produtos usando o seu software de helpdesk,200,0,0,16,31,2017-03-16
http://freshdesk.com.br/escalar-o-suporte/portal-de-autoatendimento/,Portal de Autoatendimento | Proporcione aos seus clientes a liberdade do autossuporte,200,0,0,14,37,2017-11-16
http://freshdesk.com.br/emissao-de-tickets,Recursos de emissão de tickets eficazes para suporte ao cliente com o Freshdesk,200,0,0,16,65,2017-11-28
http://freshdesk.com.br/integracoes/,"Integrações Freshdesk | Software de helpdesk que integra com Capsule CRM, Freshbooks, Harvest, JIRA, para um suporte All-In-One",200,0,0,14,26,2017-05-07
http://freshdesk.com.br/gerenciamento-do-helpdesk/helpdesk-aplicativos-moveis,Freshdesk pra Dispositivos Móveis | Atenda os seus clientes onde estiver,200,0,0,14,32,2017-12-08
http://freshdesk.com.br/gerenciamento-do-helpdesk/,Gerenciar o seu helpdesk | Software de suporte ao cliente do Freshdesk,200,0,0,14,35,2017-06-26
http://freshdesk.com.br/inscreva-se/?plan=sprout,Suporte ao cliente Freshdesk e software de helpdesk | Obtenha GRÁTIS,200,0,0,4,3,2017-11-16
http://freshdesk.com.br/integracoes/social-help-desk-facebook,Facebook – Integração do Freshdesk | Converter comentários do FB e postagens no mural em tickets do helpdesk,200,0,0,14,30,2017-05-02
http://freshdesk.com.br/gerenciamento-do-helpdesk/caixa-de-entrada-compartilhada,Caixa de entrada compartilhada para a equipe de atendimento ao cliente | Freshdesk – o melhor software colaborativo de suporte ao cliente,200,0,0,14,33,2017-06-16
http://freshdesk.com.br/customer-care-tools/,Freshdesk | Ferramenta de atendimento ao cliente online e aplicativo de central de suporte,200,0,0,7,3,2017-11-28
http://freshdesk.com.br/inscreva-se/?plan=blossom,Suporte ao cliente Freshdesk e software de helpdesk | Obtenha GRÁTIS,200,0,0,4,3,2017-12-08
http://freshdesk.com.br/escalar-o-suporte/portal-de-autoatendimento/#demo-form,Portal de Autoatendimento | Proporcione aos seus clientes a liberdade do autossuporte,200,0,0,14,37,2017-12-08
http://freshdesk.com.br/helpdesk-global/,Escale seu suporte no mundo com o Freshdesk,200,0,0,14,64,2017-06-25
http://freshdesk.com.br/gerenciamento-do-helpdesk/helpdesk-aplicativos-moveis/,Freshdesk pra Dispositivos Móveis | Atenda os seus clientes onde estiver,200,0,0,17,29,2017-02-16
http://freshdesk.com.br/gerenciamento-do-helpdesk/relatorios-de-helpdesk/,Relatórios avançados de helpdesk para melhorar o desempenho de seu serviço de atendimento ao cliente | Análise da atividade do cliente e criação de um quadro de horários de operadores do suporte com o software Freshdesk,200,0,0,14,33,2017-06-25
http://freshdesk.com.br/gerenciamento-do-helpdesk/caixa-de-entrada-compartilhada/,Caixa de entrada compartilhada para a equipe de atendimento ao cliente | Freshdesk – o melhor software colaborativo de suporte ao cliente,200,0,0,18,29,2017-02-10
http://freshdesk.com.br/escalar-o-suporte/helpdesk-ticket-gerenciamento-sla,Gerenciamento de SLA do Helpdesk do Freshdesk | Melhorar o suporte ao cliente com Políticas do Acordo de Nível de Serviço de nível 4,200,0,0,14,37,2017-06-25
http://freshdesk.com.br/envolvimento-do-cliente/inquerito-de-satisfacao-do-cliente,Inquérito de satisfação dos clientes de helpdesk | Avalie seus serviços de helpdesk com inquéritos e relatórios de satisfação dos clientes do Freshdesk,200,0,0,14,34,2017-06-25
http://freshdesk.com.br/gerenciamento-do-helpdesk/emissao-de-tickets-de-helpdesk-por-email/,Responda aos seus tickets de suporte através do email sem fazer logon no seu Suporte | Software de Suporte ao Cliente Freshdesk,200,0,0,19,31,2017-03-16
http://freshdesk.com.br/escalar-o-suporte/helpdesk-com-varios-fusos-horarios/,Helpdesk com vários fusos horários | Ofereça suporte contínuo com o helpdesk global do Freshdesk,200,0,0,14,31,2017-11-28
http://freshdesk.com.br/emissao-de-tickets/,Recursos de emissão de tickets eficazes para suporte ao cliente com o Freshdesk,200,0,0,16,65,2017-06-25
http://freshdesk.com.br/suporte-multicanal/,Software de suporte ao cliente multicanal do Freshdesk,200,0,0,14,69,2017-06-16
http://freshdesk.com.br/inscreva-se/?plan=garden,Suporte ao cliente Freshdesk e software de helpdesk | Obtenha GRÁTIS,200,0,0,4,3,2017-11-16
http://freshdesk.com.br/gerenciamento-do-helpdesk/controle-de-tempo,Controle de tempo online para tickets e operadores de suporte | Faturação fácil dos clientes com o software de helpdesk Freshdesk,200,0,0,14,34,2017-11-28
http://freshdesk.com.br/escalar-o-suporte/multiplas-politicas-sla/,Várias políticas de SLA do Freshdesk | Resolução do ticket personalizável e tempo de resolução,200,0,0,14,37,2017-06-26
http://freshdesk.com.br/suporte-multicanal/suporte-telefone,Suporte por telefone | Suporte de voz integrado do Freshdesk,200,0,0,15,31,2017-11-28
http://freshdesk.com.br/distribuidor-automatico-tickets/,,404,0,0,1,4,2017-10-24
http://freshdesk.com.br/suporte-multicanal/suporte-telefone/,Suporte por telefone | Suporte de voz integrado do Freshdesk,200,0,0,17,29,2017-03-16
http://freshdesk.com.br/forum-da-comunidade/,,404,0,0,1,4,2017-11-10
http://freshdesk.com.br/supervisionar-processos-suporte/,,404,0,0,1,4,2017-11-01
http://freshdesk.com.br/observador/,,404,0,0,1,4,2017-08-12
http://freshdesk.com.br/gerenciamento-do-helpdesk/relatorios-de-helpdesk,Relatórios avançados de helpdesk para melhorar o desempenho de seu serviço de atendimento ao cliente | Análise da atividade do cliente e criação de um quadro de horários de operadores do suporte com o software Freshdesk,200,0,0,14,33,2017-06-16
http://freshdesk.com.br/free-help-desk-software/,Software Helpdesk Gratuito | Melhor Sistema de Ticket para o seu Negócio - Freshdesk,200,0,0,4,3,2017-06-25
http://freshdesk.com.br/envolvimento-do-cliente/helpdesk-para-midias-sociais/,"Helpdesk para mídias sociais: conquiste, socialize e dê suporte com software Freshdesk",200,0,0,14,31,2017-06-26
http://freshdesk.com.br/gerenciamento-do-helpdesk/base-de-conhecimento/,Gerenciamento da base de conhecimento agora mais fácil com o Software Helpdesk do Freshdesk | Manter os artigos da BC atualizados para melhoramento do suporte e satisfação do cliente,200,0,0,17,32,2017-02-26
http://freshdesk.com.br/escalar-o-suporte/helpdesk-com-varios-fusos-horarios,Helpdesk com vários fusos horários | Ofereça suporte contínuo com o helpdesk global do Freshdesk,200,0,0,14,31,2017-06-16
http://freshdesk.com.br/precos/,Planos e preços do Freshdesk | Avaliação do software de helpdesk Freshdesk,200,0,0,14,34,2017-06-25
http://freshdesk.com.br/personalizacao-do-helpdesk/recriar-portal-do-helpdesk/,Recrie e personalize seu portal de suporte com o software de helpdesk Freshdesk.,200,0,0,18,32,2017-02-10
http://freshdesk.com.br/aplicativos-de-terceiros/,Amplie suas capacidades de suporte com integrações no Freshdesk,200,0,0,16,63,2017-12-08
http://freshdesk.com.br/gerenciamento-do-helpdesk/mobile-app-help-desk/,,404,0,0,1,4,2017-04-11
http://freshdesk.com.br/escalar-o-suporte/detecao-de-sobreposicao-de-operadores/,Detecte e evite a sobreposição de operadores do suporte,200,0,0,14,31,2017-12-08
http://freshdesk.com.br/demo-completion/,,200,0,0,1,4,2017-11-16
http://freshdesk.com.br/suporte-multicanal/chat-online/,Suporte por chat em tempo real integrado do Freshdesk,200,0,0,17,28,2017-02-26
http://freshdesk.com.br/escalar-o-suporte/helpdesk-ticket-gerenciamento-sla/,Gerenciamento de SLA do Helpdesk do Freshdesk | Melhorar o suporte ao cliente com Políticas do Acordo de Nível de Serviço de nível 4,200,0,0,14,37,2017-06-25
http://freshdesk.com.br/relatorios/#,Calcule e controle o desempenho usando os relatórios helpdesk,200,0,0,14,65,2017-12-02
http://freshdesk.com.br/escalar-o-suporte/helpdesk-para-varios-produtos/,Ofereça suporte para vários produtos a partir de uma conta de helpdesk Freshdesk | Ferramenta única de emissão de tickets que permite dar suporte a seus clientes através de várias caixas de entrada e portais,200,0,0,14,36,2017-06-25
http://freshdesk.com.br/relatorios/,Calcule e controle o desempenho usando os relatórios helpdesk,200,0,0,14,64,2017-06-16
http://freshdesk.com.br/automatizacao-do-helpdesk/observador,Observador – Automação acionada por evento no software de suporte ao cliente,200,0,0,14,35,2017-06-25
http://freshdesk.com.br/helpdesk-aplicativos-moveis/,,404,0,0,1,4,2017-11-01
http://freshdesk.com.br/chat-online/,,404,0,0,1,4,2017-09-25
http://freshdesk.com.br/suporte-multicanal/chat-online/#demo-form,Suporte por chat em tempo real integrado do Freshdesk,200,0,0,14,31,2017-12-08
http://freshdesk.com.br/gamification-suporte-help-desk/,,404,0,0,1,4,2017-11-10
http://freshdesk.com.br/inscreva-se/?plan=forest,Suporte ao cliente Freshdesk e software de helpdesk | Obtenha GRÁTIS,200,0,0,4,3,2017-11-28
http://freshdesk.com.br/automatizacao-do-helpdesk,Automatização do helpdesk para facilitar o suporte ao cliente,200,0,0,14,39,2017-06-25
http://freshdesk.com.br/gerenciamento-do-helpdesk/controle-de-tempo/,Controle de tempo online para tickets e operadores de suporte | Faturação fácil dos clientes com o software de helpdesk Freshdesk,200,0,0,16,32,2017-02-10
http://freshdesk.com.br/personalizacao-do-helpdesk/custom-ticket-statuses/,,404,0,0,1,4,2017-04-11
http://freshdesk.com.br/personalizacao-do-helpdesk/status-de-tickets-customizados/,Estados de ticket personalizados | Aplique seu fluxo de trabalho corporativo ao suporte com o Freshdesk,200,0,0,14,35,2017-06-26
http://freshdesk.com.br/servco-de-autoatendimento/,Crie uma experiência de autoatendimento que ofereça suporte à sua marca,200,0,0,14,64,2017-06-26
http://freshdesk.com.br/aplicativos-de-terceiros,Amplie suas capacidades de suporte com integrações no Freshdesk,200,0,0,16,63,2017-11-16
http://freshdesk.com.br/automatizacao-do-helpdesk/observador/,Observador – Automação acionada por evento no software de suporte ao cliente,200,0,0,17,32,2017-02-10
http://blog.freshdesk.com.br/o-que-rolou-no-freshdesk-meeting/,O que rolou no Freshdesk meeting - Freshdesk | Portuguese,200,0,0,9,16,2017-12-04
http://blog.freshdesk.com.br/author/alan/,"Alan Berkson, Author at Freshdesk | Portuguese",200,0,0,16,22,2017-12-09
http://blog.freshdesk.com.br/gerenciamento-de-incidentes-como-ter-certeza-que-nenhum-ticket-caia-no-esquecimento/,Gerenciamento de Incidentes – Como ter certeza que nenhum ticket caia no esquecimento - Freshdesk | Portuguese,200,0,0,11,15,2017-12-09
http://blog.freshdesk.com.br/author/sanju/,"Sanjeevitha Krishnamoorthy, Author at Freshdesk | Portuguese",200,0,0,14,26,2017-11-14
http://blog.freshdesk.com.br/por-que-voce-deve-implementar-o-itil-em-sua-empresa-e-agora/,"Por que você deve implementar o ITIL em sua empresa, e agora! - Freshdesk | Portuguese",200,0,0,9,15,2017-12-04
http://freshdesk.com.br/free-help-desk-software,Software Helpdesk Gratuito | Melhor Sistema de Ticket para o seu Negócio - Freshdesk,200,0,0,4,3,2017-11-28
http://blog.freshdesk.com.br/conferencia-global-de-revendas-freshdesk/,Conferência Global de Revendas Freshdesk - Freshdesk | Portuguese,200,0,0,11,17,2017-12-09
http://blog.freshdesk.com.br/author/divyalakshmi/,"Divyalakshmi Prabakar, Author at Freshdesk | Portuguese",200,0,0,14,22,2017-11-14
http://blog.freshdesk.com.br/saudade-alo-da-india/,Que saudade! Alô da Índia! - Freshdesk | Portuguese,200,0,0,12,16,2017-12-09
http://blog.freshdesk.com.br/como-contratar-um-profissional-para-suporte-ao-cliente/,Como contratar um profissional para o Suporte ao Cliente - Freshdesk | Portuguese,200,0,0,9,15,2017-12-09
http://blog.freshdesk.com.br/6-metricas-para-te-ajudar-melhorar-o-desempenho-do-call-center/,6 métricas para te ajudar melhorar o desempenho do call center - Freshdesk | Portuguese,200,0,0,13,15,2017-12-09
http://blog.freshdesk.com.br/category/customer-service/,Customer Service Archives - Freshdesk | Portuguese,200,0,0,14,24,2017-12-09
http://blog.freshdesk.com.br/gerenciamento-de-servicos-empresariais-6-dicas-para-gerentes-de-rh/,Gerenciamento de Serviços Empresariais: 6 Dicas para Gerentes de RH - Freshdesk | Portuguese,200,0,0,10,15,2017-11-14
http://blog.freshdesk.com.br/category/atendimento-ao-cliente/,Atendimento ao Cliente Archives - Freshdesk | Portuguese,200,0,0,14,22,2017-11-27
http://blog.freshdesk.com.br/sucesso-da-natura-seu-publico/,O sucesso da Natura com o seu público - Freshdesk | Portuguese,200,0,0,9,15,2017-12-09
http://blog.freshdesk.com.br/visite-stande-da-freshservice-na-conferencia-hdi-brasil-2016-adorariamos-conhece-lo/,"Visite o Stande da Freshservice na Conferência HDI Brasil 2016, adoraríamos conhecê-lo! - Freshdesk | Portuguese",200,0,0,9,15,2017-11-14
http://blog.freshdesk.com.br/por-que-voce-deve-tornar-seu-helpdesk-um-jogo/,Por Que Você Deve Tornar Seu Helpdesk um Jogo? - Freshdesk | Portuguese,200,0,0,9,15,2017-11-14
http://blog.freshdesk.com.br/category/customer-support/,customer support Archives - Freshdesk | Portuguese,200,0,0,14,24,2017-12-09
http://blog.freshdesk.com.br/autores/,Autores - Freshdesk | Portuguese,200,0,0,24,54,2017-12-09
http://blog.freshdesk.com.br/5-tendencias-em-atendimento-ao-cliente-para-2014/,5 Tendências em Atendimento ao Cliente para 2014 - Freshdesk | Portuguese,200,0,0,13,15,2017-12-04
http://blog.freshdesk.com.br/author/jyotsna/,"Jyotsna Hariharan, Author at Freshdesk | Portuguese",200,0,0,15,23,2017-12-09
http://blog.freshdesk.com.br/author/ankit/,"Ankit Thakrar, Author at Freshdesk | Portuguese",200,0,0,14,23,2017-11-14
http://blog.freshdesk.com.br/author/sairam/,"Sairam Krishnan, Author at Freshdesk | Portuguese",200,0,0,14,22,2017-12-04
http://blog.freshdesk.com.br/o-que-as-empresas-realmente-querem-do-itsm/,O que as empresas realmente querem do ITSM? - Freshdesk | Portuguese,200,0,0,14,15,2017-11-14
http://blog.freshdesk.com.br/author/daveangelow/,"Dave Angelow, Author at Freshdesk | Portuguese",200,0,0,14,22,2017-12-09
http://blog.freshdesk.com.br/category/event-updates/,Event updates Archives - Freshdesk | Portuguese,200,0,0,14,25,2017-12-09
http://blog.freshdesk.com.br/author/vijay/,"Vijay Shankar, Author at Freshdesk | Portuguese",200,0,0,15,22,2017-12-04
http://blog.freshdesk.com.br/category/it-support/,IT Support Archives - Freshdesk | Portuguese,200,0,0,14,28,2017-11-14
http://blog.freshdesk.com.br/author/sajeesh/,"Sajeesh Sahadevan, Author at Freshdesk | Portuguese",200,0,0,15,22,2017-12-04
http://blog.freshdesk.com.br/como-utilizar-hdi-para-aumentar-sua-produtividade/,Como utilizar a HDI para aumentar sua produtividade? - Freshdesk | Portuguese,200,0,0,9,15,2017-12-04
http://blog.freshdesk.com.br/author/stephen/,"Stephen Mann, Author at Freshdesk | Portuguese",200,0,0,16,22,2017-12-04
http://blog.freshdesk.com.br/bom-service-desk-vs-ruim-service-desk/,Bom Service Desk vs Ruim Service Desk - Freshdesk | Portuguese,200,0,0,10,15,2017-12-09
http://blog.freshdesk.com.br/venha-participar-do-freshdesk-meeting/,Venha participar do Freshdesk Meeting - Freshdesk | Portuguese,200,0,0,10,15,2017-12-04
http://blog.freshdesk.com.br/o-alto-custo-de-um-gerenciamento-de-ativos-mal-feito/,O Alto Custo de um Gerenciamento de Ativos Mal Feito - Freshdesk | Portuguese,200,0,0,11,15,2017-12-04
http://blog.freshdesk.com.br/pos-venda-voce-esta-abandonando-seus-clientes/,Pós-Venda: Você Está Abandonando Seus Clientes? - Freshdesk | Portuguese,200,0,0,11,15,2017-11-14
http://blog.freshdesk.com.br/category/feature-announcements/,Feature Announcements Archives - Freshdesk | Portuguese,200,0,0,14,22,2017-11-27
http://blog.freshdesk.com.br/author/aishwarya/,"Aishwarya Hariharan, Author at Freshdesk | Portuguese",200,0,0,17,23,2017-12-09
